{
  "schema": "campfire.action-grant/v1",
  "issuer": "urn:campfire:action-authority",
  "audience": "urn:steamcloud:agent",
  "run_id": "run_demo",
  "work_id": "work_demo",
  "attempt_id": "attempt_demo",
  "action_intent_id": "intent_demo",
  "tenant_id": "ten_demo",
  "account_id": "acct_demo",
  "operation": "steam.profile.public.refresh",
  "arguments_sha256": "aaaaaaaaaaaaaaaaaaaaaaaaaaaaaaaaaaaaaaaaaaaaaaaaaaaaaaaaaaaaaaaa",
  "idempotency_key": "intent_demo",
  "lease_fences": {
    "steam-account:acct_demo": 3
  },
  "credential_generation": 2,
  "runtime_generation": 4,
  "expires_at": "2026-08-18T16:01:00Z"
}
